{"allowed_sources":[{"source_id":"S1","tier":"S1","uri_or_path":"https://data.eastmoney.com/notices/detail/600309/AN202604201821348358.html"},{"source_id":"S10","tier":"S1","uri_or_path":"https://data.eastmoney.com/notices/detail/600309/AN202604281821669456.html"},{"source_id":"S11","tier":"S1","uri_or_path":"https://data.eastmoney.com/notices/detail/600309/AN202601081816851241.html"},{"source_id":"S12","tier":"S1","uri_or_path":"https://data.eastmoney.com/notices/detail/600309/AN202601301818582342.html"},{"source_id":"S2","tier":"S1","uri_or_path":"https://data.eastmoney.com/notices/detail/600309/AN202604201821348340.html"},{"source_id":"S3","tier":"S1","uri_or_path":"https://data.eastmoney.com/notices/detail/600309/AN202604201821348367.html"},{"source_id":"S4","tier":"S1","uri_or_path":"https://data.eastmoney.com/notices/detail/600309/AN202604201821348372.html"},{"source_id":"S5","tier":"S1","uri_or_path":"https://data.eastmoney.com/notices/detail/600309/AN202607061826746921.html"},{"source_id":"S6","tier":"S1","uri_or_path":"https://data.eastmoney.com/notices/detail/600309/AN202604201821348349.html"},{"source_id":"S7","tier":"S1","uri_or_path":"https://data.eastmoney.com/notices/detail/600309/AN202607141826956222.html"},{"source_id":"S8","tier":"S1","uri_or_path":"https://data.eastmoney.com/notices/detail/600309/AN202606221823743359.html"},{"source_id":"S9","tier":"S1","uri_or_path":"https://data.eastmoney.com/notices/detail/600309/AN202606101823422177.html"}],"claims":[{"category":"fact","claim":"2025年聚氨酯、石化、精细化学品及新材料收入分别为750.58、842.04、331.89亿元，毛利率分别为26.88%、0.58%、10.53%；石化收入增长并未转化为相称利润。","claim_id":"C1","falsifiers":["半年报披露石化分部毛利率持续高于8%且并非库存收益","公司更正2025年分部数据"],"source_ids":["S1","S2"],"verification_metrics":["三大系列收入与毛利率","石化毛利额","分系列折旧"]},{"category":"investment","claim":"按MDI、TDI、石化和新材料分别正常化后，集团可持续归母净利润约140至170亿元，明显低于将2026H1峰值简单年化的口径。","claim_id":"C10","falsifiers":["2026至2028年归母净利润连续高于200亿元且自由现金流同步","MDI/TDI中枢价差永久上移并由供需数据验证"],"source_ids":["S1","S2","S3","S4","S5"],"verification_metrics":["分部正常化毛利","共享费用与利息","少数股东损益","全年归母净利润"]},{"category":"investment","claim":"独立承保应对MDI、TDI、石化和新材料分别估计正常化经营贡献，并单列维持性资本开支、净债务、新项目ROIC和周期敏感性；2026H1利润仅能作为情景证据，不能直接年化。","claim_id":"C11","falsifiers":["公司后续披露足以证明H1利润主要来自可持续销量、成本优势与现金回报","维持性资本开支和净债务口径显著低于当前估计且可由正式披露验证"],"source_ids":["S1","S3","S5"],"verification_metrics":["分部正常化经营贡献","正常化FCFF","维持性资本开支","净债务","新项目ROIC","资本成本"]},{"category":"business","claim":"异氰酸酯技术、规模与一体化仍是核心优势，但MDI与TDI未单独披露销量和利润，不能把聚氨酯整体毛利机械归给MDI。","claim_id":"C2","falsifiers":["公司披露MDI或TDI单品长期亏损","聚氨酯产能利用率连续两年低于70%","海外核心装置发生非计划长期停产"],"source_ids":["S1","S2","S4","S7","S8"],"verification_metrics":["MDI/TDI分产品销量与毛利","聚氨酯产能利用率","计划检修天数"]},{"category":"industry","claim":"2026Q1纯MDI、聚合MDI、TDI均价分别约2.00、1.55、1.58万元/吨，较2025全年1.85、1.62、1.35万元/吨呈分化；H1利润跳升主要由价格与供需扰动驱动，不宜峰值年化。","claim_id":"C3","falsifiers":["2026H2价格回落但利润率仍因结构性成本下降维持","半年报证明利润增长主要来自可持续销量和固定成本摊薄"],"source_ids":["S2","S4","S5"],"verification_metrics":["MDI/TDI月均价格","纯苯与能源成本","H2分系列毛利率"]},{"category":"investment","claim":"石化板块应按低回报或接近盈亏平衡正常化，乙烯一期原料多元化可改善成本，但新乙烯与PDH/POCHP资产尚未证明全周期ROIC高于资本成本。","claim_id":"C4","falsifiers":["石化板块连续四个季度毛利率高于8%且经营现金流为正","烯烃子公司披露全周期ROIC持续高于10%"],"source_ids":["S1","S4","S5","S9","S10","S11","S12"],"verification_metrics":["石化系列毛利率","烯烃子公司ROIC","PDH/乙烯价差","新增资产折旧后利润"]},{"category":"investment","claim":"新材料收入增长快于集团，但2025年毛利率仅10.53%且折旧同比增长32.45%，现阶段应按爬坡资产估值，不能按成熟特种材料高倍数资本化。","claim_id":"C5","falsifiers":["新材料毛利率连续四个季度超过18%","公司披露高端新材料分部资本回报持续高于12%"],"source_ids":["S1","S2","S4"],"verification_metrics":["新材料毛利率","客户认证与销量","分部折旧","新项目ROIC"]},{"category":"fact","claim":"2025年经营现金流331.05亿元、购建长期资产现金支出307.11亿元，报告口径自由现金流仅23.94亿元；高经营现金流不能脱离增长资本开支解读。","claim_id":"C6","falsifiers":["公司披露维护性资本开支显著低于本报告估计且剩余项目全部自筹","未来两年资本开支下降至折旧附近同时产能稳定"],"source_ids":["S1","S3"],"verification_metrics":["经营现金流","资本开支","维护性与增长性资本开支","折旧"]},{"category":"fact","claim":"2026Q1末计息债务约1347.6亿元、货币资金468.3亿元及交易性金融资产25.0亿元，保守净债务约854亿元；资产负债率约64.3%，杠杆约束真实存在。","claim_id":"C7","falsifiers":["半年报净债务下降300亿元以上且非依赖处置资产","公司更正债务或现金口径"],"source_ids":["S3"],"verification_metrics":["短期借款","一年内到期非流动负债","长期借款","应付债券","现金与净债务"]},{"category":"fact","claim":"2025年在建工程转固575.77亿元、年末仍有311.12亿元重要在建工程账面价值，新增折旧将继续考验产能利用率与项目回报。","claim_id":"C8","falsifiers":["新增装置两年内满负荷且新增EBIT覆盖资本成本","项目出现重大减值或永久停建"],"source_ids":["S1","S12"],"verification_metrics":["在建工程转固","期末在建工程","固定资产折旧","产能利用率"]},{"category":"business","claim":"2025年主要日常关联交易实际发生15.26亿元，占集团收入较低且按关联交易规则履行审议程序，但同一国资体系下的产品、工程与劳务交易仍需持续核对定价与应收回款。","claim_id":"C9","falsifiers":["关联交易金额或关联应收异常增长","监管认定定价不公允或发生资金占用"],"source_ids":["S1","S6"],"verification_metrics":["关联交易金额与占比","关联应收账款","定价政策","关联董事与相关股东未参与表决"]}],"created_at":"2026-07-27T01:20:16.965110+08:00","packet_id":"2026-07-27-priority-v4-001-CN-600309","review_id":"2026-07-27-priority-v4-001","schema_version":2,"source_report_sha256":"7738a44253370ffa7899b5dfa74f0d5483ccb2d39f28d5ae73003e22da0d258c","symbol":"CN:600309"}